,Songs,Listeners,Playcount,Duration,Tags
0,Trevo (Tu),9164,65692,205000,[]
1,From Hell do Céu,7706,56324,240000,"[u'rap', u'Hip-Hop', u'underground hip-hop', u'Rap Nacional', u'geografia']"
2,Rolo Compressor,3384,15967,192000,[]
3,Na Segunda Vinda,9565,68918,268000,"[u'Rap Nacional', u'amigos', u'rap', u'ragga', u'dancehall', u'divers\xe3o', u'br4z1l14n f4nk7 k0r3', u'petrus']"
4,Rock'n'roll,2457,7837,0,[]
5,Mister Niterói,10402,89227,238000,"[u'ragga', u'dancehall']"
6,Identidade,3356,12580,230000,[]
7,Babylon By Gus,15403,109925,259000,"[u'rap', u'Nacional', u'rapera', u'Hip-Hop', u'Rap Nacional', u'black alien', u'zeca', u'OpelMelange']"
8,Como Eu Te Quero,15435,114747,212000,"[u'Hip-Hop', u'brasil', u'Brasil Rap', u'brazil', u'Black', u'latin hip-hop', u'rap', u'Radio', u'mpb', u'Rap Nacional', u'bom', u'como eu te quero']"
9,Perícia na Delícia,5667,30409,222000,"[u'rap', u'Rap Nacional', u'latin-raggaton']"
10,Cor De Marte,7978,77516,191000,[]
11,Trevo (Tu),9164,65692,205000,[]
12,Tempos Modernos,29198,155509,423000,"[u'mpb', u'Nacional', u'pop', u'pop rock', u'brasil', u'lulu santos', u'rock nacional', u'lulu', u'rock brasilero', u'seen live', u'childhood', u'1982', u'makes me wanna dance', u'rj', u'best of 1982', u'los hermanos', u'As melhores do Brasil', u'funk nacional', u'pop nacional', u'favorite lyrics', u'melhor de 1982', u'tempos', u'Eu gostei', u'afrociberdelics', u'lehugeur', u'eltonluc', u'loungetl', u'lulu santos-tempos modernos', u'brasil rock leve', u'Elton Lima', u'Elton Limma', u'guitar real iv', u'lulu santos tempos mordenos', u'80s collections']"
13,Toda Forma De Amor,17048,80442,220000,"[u'pop rock', u'Love', u'Awesome', u'brasil', u'brazilian', u'Romantica', u'lulu', u'As melhores do Brasil', u'lulu santos', u'sicasspop', u'MelS2Messias', u'Elton Lima', u'Elton Limma']"
14,Apenas Mais Uma De Amor,38216,220703,218000,"[u'Love', u'pop', u'pop rock', u'rock nacional', u'90s', u'brazilian', u'brazilian rock', u'my 500 essential songs', u'lulu santos', u'pop nacional', u'chillout', u'acoustic', u'brasil', u'mpb', u'male vocalists', u'Ballad', u'Baladas', u'DNA', u'Nacional', u's2', u'best of 1992', u'sister shit', u'minhas', u'Melhor de 1992', u'mela cueca', u'slytherin pride', u'brasilianisch', u'Elton Lima', u'Elton Limma', u'Eu Toco']"
15,Sozinho - Live in Brazil / 1998,16264,59528,0,[u'folk']
16,Pra Você Dar o Nome,19348,212929,242000,"[u'mpb', u'Love', u'top', u'brazilian', u'2012', u'amor', u'fim', u'preferido', u'so much feelings']"
17,Trevo (Tu),9164,65692,205000,[]
18,Yesterday - Remastered 2009,70010,180315,0,[]
19,Take It Easy,416581,1802359,209000,"[u'classic rock', u'Eagles', u'70s', u'rock', u'country', u'country rock', u'oldies', u'soft rock', u'Southern Rock', u'take it easy', u'pop', u'easy listening', u'Mellow', u'Driving', u'Eagles - Take It Easy', u'relaxing', u'male vocalists', u'folk rock', u'chill', u'classic', u'favorites', u'80s', u'american', u'summer', u'1972', u'banjo', u'relax', u'folk', u'Love', u'acoustic', u'the eagles', u'sufu5a', u'pop rock', u'country-rock', u'guitar', u'west coast', u'fun', u'rock n roll', u'road trip', u'Legendary', u'oh yeah this is what my doctor told me I needed', u'Progressive rock', u'happy', u'americana', u'beautiful', u'Awesome', u'laid back', u'optimistic', u'Favorite', u'feelgood']"
20,Imagine - 2010 - Remaster,96493,317454,184000,"[u'pop', u'rock', u'pure-70', u'oldies', u'1971', u""70's"", u'70s soft rock', u'pure-peace', u'pure-megafav']"
21,Wish You Were Here - 2011 Remastered Version,111440,448134,0,"[u'70s progressive rock', u'if this song were a girl i would fuck her or at least touch her tits', u'genre: progressive rock', u'radio-moonlight-progressive rock', u'the ost']"
22,Tears in Heaven,771608,3778720,273000,"[u'classic rock', u'blues', u'acoustic', u'guitar', u'rock', u'eric clapton', u'sad', u'singer-songwriter', u'blues rock', u'Ballad', u'90s', u'tears in heaven', u'Mellow', u'beautiful', u'british', u'pop', u'male vocalists', u'Love', u'clapton', u'easy listening', u'melancholy', u'soft rock', u'male vocalist', u'slow', u'guitar virtuoso', u'favorites', u'oldies', u'acoustic guitar', u'romantic', u'chillout', u'80s', u'emotional', u'heaven', u'classic', u'ballads', u'Awesome', u'relax', u'Unplugged', u'melancholic', u'Tears', u'eric', u'chill', u'1992', u'give him another chance', u'soul', u'smooth', u'love songs', u'hans henny jahnn', u'Eric Clapton - Tears in Heaven', u'sad maniac']"
23,Layla,659000,3246746,430000,"[u'classic rock', u'rock', u'blues', u'blues rock', u'guitar', u'eric clapton', u'70s', u'acoustic', u'Layla', u'singer-songwriter', u'british', u'live', u'favorites', u'Unplugged', u'clapton', u'classic', u'80s', u'Awesome Guitar Jams', u'guitar virtuoso', u'oldies', u'pop', u'blues-rock', u'Love', u'Guitar Gods', u'favorite songs', u'90s', u'Guitar Hero', u'Awesome', u'Guitar Solo', u'60s', u'hard rock', u'male vocalists', u'slowhand', u'jazz', u'chill', u'epic', u'beautiful', u'Acoustic Rock', u'Favorite', u'names', u'legend', u'clapton is god', u'piano', u'soft rock', u'amazing', u'loved', u'cool', u'powerful', u'Favourite Songs', u'guitar god']"
24,Hotel California,1140414,6603351,390000,"[u'classic rock', u'rock', u'70s', u'Eagles', u'oldies', u'Hotel California', u'soft rock', u'classic', u'guitar', u'pop', u'favorites', u'Ballad', u'80s', u'easy listening', u'country rock', u'California', u'american', u'rock ballad', u'country', u'Southern Rock', u'Mellow', u'Favourites', u'acoustic', u'Awesome Guitar Jams', u'Guitar Solo', u'ballads', u'male vocalists', u'epic', u'chill', u'favorite songs', u'hard rock', u'beautiful', u'Love', u'relax', u'hotel', u'Awesome', u'classics', u'the eagles', u'chillout', u'male vocalist', u'legend', u'summer', u'pop rock', u'memories', u'Favorite', u'Favourite Songs', u'70s rock', u'60s', u'cool', u'live']"
25,Shelter from the Storm,304997,1445950,299000,"[u'folk', u'singer-songwriter', u'rock', u'classic rock', u'Bob Dylan', u'70s', u'folk rock', u'acoustic', u'Dylan', u'folk-rock', u'60s', u'blues', u'oldies', u'classic', u'blues rock', u'folkrock', u'favorites', u'beautiful', u'american', u'1975', u'songs that tell stories', u'singer-songwritergdchill', u'american i like', u'Love', u'guitar', u'poetry', u'pop', u'male vocalists', u'live', u'Favourites', u'alias', u'chillout', u'seen live', u'favorite songs', u'sad', u'songwriter', u'relaxing', u'male vocalist', u'singer songwriter', u'Ballad', u'rain', u'1970s', u'perfect', u'music', u'bob', u'absolutely amazing', u'critically acclaimed song', u'acclaimed music top 3000 bubbling under', u'shelter from the storm', u'ellias']"
26,Fakin It (feat. Ofelia K),12559,36588,0,[]
27,Locked Away,120097,686540,227000,[u'rock city']
28,Big in Japan - original,58373,229725,0,"[u'80s', u'synthpop', u'new wave', u'synth pop', u'melancholic', u'fiesta', u'Made In Germany', u'Modern Talking', u'reasons why i love 80s', u'uvita fiesta']"
29,You Oughta Know - 2015 Remastered,14911,35258,0,[]
30,Hearts Alive,117488,603682,820000,"[u'Progressive metal', u'epic', u'metal', u'i had to change my pants after this song', u'Sludge', u'metalcore', u'Progressive rock', u'alternative metal', u'Masterpiece', u'whalecore', u'sludge metal', u'post metal', u'this is how guitars are supposed to sound', u'experimental', u'intense', u'stoner metal', u'heavy metal', u'rock', u'alternative', u'hardcore', u'Progressive', u'trippy', u'post-hardcore', u'brilliant', u'colossal', u'Progressive Sludge Metal', u'Mastodon', u'Songs over 10 minutes long', u'brutal', u'hard rock', u'Stoner Rock', u'angry', u'insane', u'Extreme Metal', u'Legendary', u'riff', u'this is how guitars should be used', u'pretty fuckin metal', u'Oceancore', u'harmony as a violent sensation', u'seen live', u'pop', u'ambient', u'doom metal', u'quiet storm', u'kolla upp', u'beautiful', u'Awesome', u'guitar', u'bass']"
31,666 ʇ,73708,359863,252000,"[u'electronic', u'experimental', u'post pop', u'bon iver', u'666']"
32,Afraid of Everyone,300832,2726953,259000,"[u'indie rock', u'indie', u'alternative', u'rock', u'beautiful', u'lovedbyale', u'seen live', u'post-punk', u'haunting', u'Masterpiece', u'10s', u'american i like', u'2010', u'alternative rock', u'melancholic', u'male vocalists', u'best of 2010', u'sufjan stevens', u'Awesome', u'american', u'melancholy', u'emotional', u'reflection', u'love the lyrics', u'Post-punk revival', u'mpsvd-luisterpaal-j', u'vugube62', u'chill', u'sad', u'Mellow', u'great', u'Heartbreaking', u'gossip girl', u'Soundtrack Of My Life', u'indiena sound', u'cinder', u'post-rock', u'USA', u'favorites', u'london', u'Driving', u'Brooklyn', u'Like', u'Tense', u'post rock', u'great song', u'loved', u'male vocalist', u'4ad', u'great lyrics']"
33,Lonesome Bulldog,2018,5345,205000,"[u'somafm', u'Bagel']"
34,Feuer frei,206014,1345703,0,"[u'industrial metal', u'metal', u'industrial', u'german', u'rock', u'Rammstein', u'heavy metal', u'Soundtrack', u'deutsch', u'industrial rock', u'hard rock', u'alternative', u'Hard', u'germany', u'xxx', u'male vocalists', u'Neue Deutsche Haerte', u'tanz metal', u'Best of Rammstein', u'alternative rock', u'symphonic metal', u'Favourites', u'tanz-metall', u'NDH', u'German metal', u'Feuer Frei', u'Rammstein- Feuer Frei', u'dark', u'Awesome', u'Driving', u'electronic music', u'Songs that totaly rule', u'german dance metaL', u'Volkerball', u'heavy', u'epic', u'Soundtracks', u'Retro', u'great', u'alternative metal', u'live', u'2002', u'famous', u'neue deutsche h\xe4rte', u'Kicks ass', u'metal industrial', u'tanz metall', u'anti stres', u'metal top', u'classic rock']"
35,Lay You Down,716,1452,238000,[]
36,Shelter,43753,267136,218000,"[u'electronic', u'EDM']"
37,My Way,134477,738914,219000,"[u'tropical house', u'electronic', u'british', u'House', u'party', u'basic', u'EDM', u'Motivation', u'bad lyrics', u'playlista rmf fm', u'2016 single', u'bbc radio1 playlist 2016', u'Summer pt. 2', u'good garbage', u'feel so close 3.0']"
38,4 Minutes - feat. Justin Timberlake and Timbaland,88257,277382,0,"[u'pop', u'Madonna', u'female vocalists', u'dance', u'Justin Timberlake', u'rnb', u'road trip', u'2000s', u'4 minutes', u'high on life', u'fave female singers', u'fave tunez', u'dance tunez', u'Fave Male Singers', u'KDWB', u'alkosovi', u'fave duets', u'fave rnb tunez']"
39,Postcards From Italy,504434,4290660,256000,"[u'folk', u'indie', u'indie folk', u'balkan', u'Gypsy', u'alternative', u'Beirut', u'singer-songwriter', u'beautiful', u'summer', u'acoustic', u'00s', u'nostalgia', u'best of 2006', u'favorites', u'nostalgic', u'ukulele', u'Awesome', u'world', u'brilliant', u'Love', u'orchestral', u'melancholy', u'experimental', u'indie pop', u'sweet', u'male vocalists', u'Italy', u'Postcards from Italy', u'indie rock', u'Mellow', u'lovely', u'rock', u'favorite songs', u'happy', u'Lo-Fi', u'eclectic', u'2006', u'horns', u'amazing', u'Favorite', u'geography', u'Makes Me Smile', u'singer-songwritergdchill', u'Gipsy Folk', u'cute', u'Dreamy', u'trumpet', u'feel good', u'folkrock']"
40,Society,411296,3358978,236000,"[u'Soundtrack', u'acoustic', u'singer-songwriter', u'rock', u'Into the Wild', u'eddie vedder', u'folk', u'Grunge', u'alternative', u'beautiful', u'sad', u'chillout', u'society', u'pearl jam', u'alternative rock', u'Ballad', u'Mellow', u'american', u'accoustic guitar', u'lovely lyrics', u'indie', u'chill', u'great lyrics', u'00s', u'favorites', u'melancholy', u'melancholic', u'male vocalists', u'I could listen to this song forever', u'to listen with someone else late at night', u'emotional', u'soft', u'male vocalist', u'travel', u'FUCKING AWESOME', u'Favourite Songs', u'eddie', u'calm', u'Awesome', u'Soundtracks', u'haunting', u'folk rock', u'soulful', u'travelling', u'perfect', u'acoustic guitar', u'on the road', u'songs that break my brain', u'We can change the world', u'emotionally dramatic']"
41,Los Bandoleros (Feat. Tego Calderon),506,2546,304000,[]
42,Eres,102868,569904,279000,"[u'spanish', u'Love', u'alternative', u'latin', u'rock', u'beautiful', u'guitar', u'melancholy', u'World Music', u'male vocalists', u'Ballad', u'latin jazz', u'Rock en Espanol', u'Latin Rock', u'sweet', u'eclectonia', u'Favourite Songs', u'my soundtrack', u'Mexico lindo y Querido', u'penita']"
43,No Hay Nadie como Tú,15025,65158,288000,"[u'Hip-Hop', u'romantic']"
44,La Cómplice,1903,4910,0,[]
45,Tú Sí Sabes Quererme,6642,26446,247000,[u'eclectonia']
46,Flaca,81110,449023,287000,"[u'Rock Argentino', u'rock en espa\xf1ol', u'calamaro', u'spanish', u'Andres Calamaro', u'flaca', u'Rock en Espanol', u'rock', u'90s', u'Spanish Rock', u'Latin Rock', u'temazo', u'argentino', u'pop', u'singer-songwriter', u'argentina', u'Rock Latino', u'male vocalists', u'amo este tema', u'FLAKA', u'Enrique Bumbury', u'classic rock', u'male', u'sexy', u'pop rock', u'favorites', u'world', u'Ballad', u'Favorite', u'Espanol', u'cantautor', u'Love it', u'10 of 10 stars', u'favs', u'yeah', u'Romantica', u'really nice', u'favoritas', u'si', u'pop argentino', u'perro', u'pop espanol', u'clasico', u'hot man', u'top 100 tracks by VVG', u'VVG', u'rokker radio', u'ras129', u'yeahh', u'newbies']"
47,El Aguante,17616,86421,289000,"[u'latin grammy nominated', u'charly garcia']"
48,Encanto,1172,2512,0,[]
49,Caraluna,78768,298381,266000,"[u'latin', u'Bacilos - Caraluna', u'latino', u'spanish', u'bacilos', u'latin pop', u'caraluna', u'pop', u'rock en espa\xf1ol', u'espa\xf1ol', u'Colombia', u'Pop Latino', u'Rock en Espanol', u'dance', u'cumbia', u'classic', u'Love', u'beautiful', u'Spanish Rock', u'merengue', u'nostalgia', u'florida', u'favoritas', u'balada', u'bailable', u'me encanta', u'classic rock', u'Classical', u'rock', u'sad', u'USA', u'pop rock', u'favorites', u'memories', u'romantic', u'Canadian', u'2003', u'guitar', u'brazil', u'upbeat', u'argentina', u'american', u'cuba', u'brasil', u'Reggaeton', u'party music', u'favourite', u'emotional', u'brazilian', u'nice']"
50,La Flaca,103853,458277,208000,"[u'spanish', u'latin', u'Jarabe de palo', u'pop', u'Rock en Espanol', u'rock en espa\xf1ol', u'rock', u'90s', u'spanish pop', u'Latin Rock', u'Spanish Rock', u'chill', u'Espanol', u'pop rock', u'Mellow', u'trova', u'latin pop', u'spanisch', u'la flaca', u'sexy', u'singer-songwriter', u'easy listening', u'House', u'guitar', u'espa\xf1ol', u'Rock Latino', u'male vocalist', u'latino', u'pop en espanol', u'Espana', u'easy', u'pop espanol', u'fav songs', u'Rock Espanol', u'canalla', u'letras geniales', u'latin blues', u'palo', u'boulets', u'chillout', u'male', u'80s', u'alternative', u'Love', u'romantic', u'blues', u'ska', u'up', u'spain', u'cuba']"
51,La Vuelta Al Mundo,36957,264590,234000,"[u'calle 13', u'spanish', u'latin', u'latin pop', u'espa\xf1ol', u'Reggaeton', u'Beach', u'freedom', u'design', u'2012', u'onthehighway', u'drunk', u'macemorning', u'Dedicadas y dedicables']"
52,Latinoamérica,27650,168469,0,"[u'emission universelle', u'Panamericano', u'spanish', u'rock', u'world', u'Spanish Rock', u'latino', u""Rock 'n' Roll"", u'latin america', u'movida', u'folklore', u'fav', u'protest song', u'Protest', u'poverty', u'in spanish', u'2 of 10 stars', u'Ciudad Volatil', u'siniestro total', u'80s Pop Espanol', u'latino america', u'la vida tiene otro sabor y espanya es la mejor', u'folclor', u'anti-america', u'americanismo', u'pan-america', u'lucha latina']"
53,Ojos Color Sol,28264,124433,216000,"[u'folk pop', u'hip hop', u'pop', u'acoustic', u'beautiful', u'eclectonia', u'latin grammy nominated', u'Folk hop', u'silvio rodriguez', u'amor', u'calle 13', u'corporal elements', u'guitarra de palo', u'residente']"
54,A Desolation Song,74731,609990,308000,"[u'folk metal', u'doom metal', u'melancholic', u'neofolk', u'atmospheric', u'folk', u'Progressive metal', u'metal', u'acoustic', u'black metal', u'Atmospheric metal', u'night listening', u'Dark metal', u'Progressive Folk Metal', u'sad', u'Avant-Garde', u'melancholy', u'Post-Metal', u'dark', u'beautiful', u'Gothic Metal', u'dark folk', u'dark acoustic metal', u'Progressive rock', u'Awesome', u'Progressive', u'depressive', u'agalloch-a desolation song', u'post-rock', u'favorites', u'epic', u'Mellow', u'Pagan', u'atmospheric black metal', u'not doom metal', u'Agalloch', u'beyond beautiful', u'Consistent Dodo Radio - Flittering', u'heavy metal', u'rock', u'instrumental', u'ambient', u'slow', u'Gothic', u'melodic', u'song', u'haunting', u'Doom', u'winter', u'folk rock']"
55,Nude as the News,74831,376841,263000,"[u'indie', u'singer-songwriter', u'indie rock', u'female vocalists', u'alternative', u'Cat Power', u'rock', u'folk', u'90s', u'seen live', u'sadcore', u'Lo-Fi', u'Mellow', u'indie folk', u'experimental', u'sad', u'memories', u'calm', u'Favourites', u'Favourite Songs', u'The Trick is to Keep Breathing', u'soundtrack of my room', u'indie pop', u'favorites', u'beautiful', u'heard on Pandora', u'greatness in simplicity', u'noise', u'classic rock', u'electronic', u'female', u'jazz', u'pop', u'chill', u'japanese', u'80s', u'alternative rock', u'favorite songs', u'heavy', u'dance', u'repetitive', u'Love', u'epic', u'industrial', u'experimental techno', u'shoegaze', u'night', u'moody', u'swing', u'crazy']"
56,Nude as the News,74831,376841,263000,"[u'indie', u'singer-songwriter', u'indie rock', u'female vocalists', u'alternative', u'Cat Power', u'rock', u'folk', u'90s', u'seen live', u'sadcore', u'Lo-Fi', u'Mellow', u'indie folk', u'experimental', u'sad', u'memories', u'calm', u'Favourites', u'Favourite Songs', u'The Trick is to Keep Breathing', u'soundtrack of my room', u'indie pop', u'favorites', u'beautiful', u'heard on Pandora', u'greatness in simplicity', u'noise', u'classic rock', u'electronic', u'female', u'jazz', u'pop', u'chill', u'japanese', u'80s', u'alternative rock', u'favorite songs', u'heavy', u'dance', u'repetitive', u'Love', u'epic', u'industrial', u'experimental techno', u'shoegaze', u'night', u'moody', u'swing', u'crazy']"
57,Just Make It Stop,38743,135127,248000,"[u'2013', u'rock', u'indie rock', u'10s', u'2010s', u'indie', u'vocal', u'chill', u'alternative', u'duluth', u'slowcore', u'sub pop', u'Gay Metal', u'best of 2013', u'21st century', u'Channel X', u'best 2013', u'music choice: adult alternative', u'gr 11', u'yet 500']"
58,You’ll Find a Way - Switch & Sinden Remix,4578,11908,0,[]
59,I'm Gonna Be (500 Miles),424508,2591308,217000,"[u'80s', u'pop', u'rock', u'Scottish', u'happy', u'how i met your mother', u'Soundtrack', u'classic rock', u'folk rock', u'british', u'Love', u'folk', u'The Proclaimers', u'one hit wonder', u'upbeat', u'alternative', u'fun', u'party', u'male vocalists', u'himym', u'favorites', u'90s', u'scotland', u'nostalgia', u'singalong', u'500 miles', u'benny and joon', u'pop rock', u'guitar', u'classic', u'romantic', u'oldies', u'folk pop', u'Pop-Rock', u'One Hit Wonders', u'alternative rock', u'college rock', u'acoustic', u'happy happy joy joy', u'indie', u'favorite songs', u'catchy', u'Awesome', u'quirky', u'favourite', u'male vocalist', u'love songs', u'love song', u'celtic rock', u'male vocals']"
60,Santa Fe,316434,1895025,254000,"[u'indie', u'folk', u'indie folk', u'Beirut', u'love at first listen', u'alternative', u'indie pop', u'pop', u'10s', u'happy', u'world', u'summer', u'male vocalists', u'alternative pop', u'2011', u'balkan', u'fav', u'cities', u'Makes Me Smile', u'that summer', u'Disco', u'chill', u'instrumental', u'alternative rock', u'ambient', u'singer-songwriter', u'dance', u'favorites', u'calm', u'Love', u'cute', u'easy listening', u'chamber pop', u'beautiful', u'guitar', u'feel good', u'horns', u'Energetic', u'american', u'Mellow', u'Discovery', u'amazing', u'tribal', u'California', u'hypnotic', u'fun', u'not bad', u'fip', u'World Music', u'loved']"
61,Alligator Blood,3678,18600,237000,[]
62,Glamorous,404028,2109266,247000,"[u'pop', u'dance', u'rnb', u'Fergie', u'Hip-Hop', u'female vocalists', u'glamorous', u'00s', u'hip hop', u'party', u'top 40', u'love at first listen', u'sexy', u'female vocalist', u'2006', u'gossip girl', u'soul', u'favorites', u'american', u'r&b', u'dance pop', u'hot', u'catchy', u'cool', u'lovin the beat', u'female', u'chill', u'rap', u'Love', u'feel good', u'relaxing', u'glam', u'guilty pleasure', u'Love it', u'2000s', u'evening', u'black eyed peas', u'skins', u'delicious', u'songs that i will still be listening to in a billion years', u'so catchy it should be outlawed', u'r & b', u'favourite 00s', u'the dutchess', u'jazzysrnbpop', u'trance', u'indie', u'favorite songs', u'albums I own', u'USA']"
63,In the Woods,24997,163402,257000,"[u'acoustic', u'Jointstereo', u'metal', u'Melodic Death Metal', u'rock', u'instrumental', u'Progressive metal', u'doom metal', u'Progressive', u'death metal', u'interesting', u'Ballad', u'Dark metal', u'progressive melodic death metal', u'northern metal', u'recos', u'songs that give me chills', u'ghost brigade']"
64,Hear Me Now,67489,333004,193000,"[u'electronic', u'House']"
65,Brass In Pocket - 2006 Remastered Version,10575,22457,185000,[]
66,Smoke on the Water,878427,4111649,336000,"[u'classic rock', u'hard rock', u'rock', u'deep purple', u'70s', u'heavy metal', u'smoke on the water', u'guitar', u'british', u'Progressive rock', u'classic', u'Guitar Hero', u'live', u'metal', u'oldies', u'blues rock', u'Awesome Guitar Jams', u'favorites', u'legends', u'60s', u'70s rock', u'80s', u'Psychedelic Rock', u'1972', u'great riffs', u'heavy', u'Awesome', u'psychedelic', u'Supernatural', u'legend', u'Deep Purple family', u'Guitar Solo', u'epic', u'classics', u'seen live', u'male vocalists', u'guitar virtuoso', u'alternative rock', u'party', u'best', u'deep purple smoke on the water', u'Progressive', u'rock n roll', u'classic metal', u'Progressive metal', u'heavy rock', u'Deep Purple - Smoke On The Water']"
67,Promiscuous,475953,2553568,242000,"[u'pop', u'dance', u'female vocalists', u'Hip-Hop', u'rnb', u'Nelly Furtado', u'sexy', u'Canadian', u'hip hop', u'party', u'Timbaland', u'00s', u'promiscuous', u'female', u'singer-songwriter', u'favorites', u'female vocalist', u'alternative', u'rap', u'club', u'r&b', u'guilty pleasure', u'Nelly', u'fun', u'2006', u'folk', u'rock', u'dance pop', u'duet', u'hot', u'2000s', u'electronic', u'catchy', u'urban', u'portuguese', u'hiphop', u'Guilty Pleasures', u""r'n'b"", u'Nelly Furtado - Promiscuous', u'canada', u'latin', u'Energetic', u'female vocals', u'Favorite', u'top 40', u'Black', u'gossip girl', u'flirty', u'loose', u'very sexy']"
68,Stressed Out,306931,3078820,202000,"[u'indie', u'alternative', u'Awesome', u'love at first listen', u'my name is blurryface and i care what you think', u'hip hop', u'pop', u'rap', u'indie pop', u'10s', u'2015', u'rock', u'alternative rock', u'american', u'summer', u'amazing', u'Uplifting', u'Ballad', u'duo', u'FUCKING AWESOME', u'feelgood', u'Stuck on repeat', u'<3', u'2016', u'indie rap', u'honest', u'hit', u'play it loud', u'2015 single', u'Turn back time', u'stressed out', u'Meyers', u'my tune', u'playlista rmf fm', u'Twenty One Pilots', u'2015 favorite', u'my top 100 of 2015', u'bbc radio1 playlist 2016', u'play pretend', u'It starts with one thing I dont know why it doesnt even matter how hard you try keep that in mind i designed this rhyme', u'born in 1988', u'generation 80s']"
69,Material Girl,406370,1849367,236000,"[u'pop', u'80s', u'Madonna', u'dance', u'female vocalists', u'fun', u'Material Girl', u'american', u""80's"", u'party', u'1984', u'rock', u'female vocalist', u'electronic', u'female', u'diva', u'classic', u'dance pop', u'1985', u'happy', u'Guilty Pleasures', u'queen of pop', u'dance-pop', u'money', u'Material', u'Madonna material girl', u'singer-songwriter', u'catchy', u'new wave', u'upbeat', u'80s Pop', u'elite beat agents', u'sexy', u'Love', u'female vocal', u'Girl', u'legend', u'like a virgin', u'USA', u'pop rock', u'favorites', u'cute', u'eighties', u'female vocals', u'cool', u'top 40', u'english', u'sing along', u'amayzes loved', u'madonna-material girl']"
70,Blood In The Cut - Aire Atlantica Remix,1869,6459,0,[]
71,All Along the Watchtower,855262,4939008,238000,"[u'classic rock', u'rock', u'60s', u'psychedelic', u'guitar', u'jimi hendrix', u'Psychedelic Rock', u'cover', u'blues', u'blues rock', u'guitar virtuoso', u'hard rock', u'Bob Dylan cover', u'classic', u'covers', u'american', u'Hendrix', u'All along the watchtower', u'Awesome', u'favorites', u'singer-songwriter', u'oldies', u'Awesome Guitar Jams', u'1968', u'Bob Dylan', u'legend', u'blues-rock', u'jimi', u'male vocalists', u'Soundtrack', u'70s', u'Acid Rock', u'Guitar Solo', u'Guitar Hero', u'hippie', u'Watchmen', u'100 Greatest Guitar Solos', u'favorite songs', u'alternative', u'experimental', u'Guitar Gods', u'epic', u'guitar god', u'Progressive rock', u'funk', u'rock n roll', u'vietnam', u'the jimi hendrix experience', u'genius', u'favourite']"
72,Char,40844,239284,188000,"[u'synthpop', u'electronic', u'House', u'Canadian', u'synth pop', u'futurepop', u'duo', u'dreamwave', u'2016 single']"
73,Orinoco Flow,277442,1640064,265000,"[u'new age', u'celtic', u'enya', u'female vocalists', u'chillout', u'ambient', u'irish', u'ethereal', u'female vocalist', u'80s', u'folk', u'relaxing', u'pop', u'easy listening', u'beautiful', u'relax', u'Mellow', u'world', u'Orinoco flow', u'1988', u'soothing', u'atmospheric', u'female', u'favorites', u'Dreamy', u'fantasy', u'chill', u'peaceful', u'smooth', u'melodic', u'Favourite Songs', u'electronic', u'Classical', u'vocal', u'instrumental', u'90s', u'Meditation', u'favorite songs', u'singer-songwriter', u'catchy', u'Awesome', u'female vocals', u'top 40', u'sensual', u'JazzysNewAge', u'rock', u'downtempo', u'synth pop', u'romantic', u'synth']"
74,Close to me - Closest Mix,9499,22788,0,[u'immer 3mal mehr herzchen lieder']
