,Songs,Listeners,Playcount,Duration,Tags
116,Rammlied,174647,1582299,318000,"[u'industrial metal', u'industrial', u'Rammstein', u'german', u'metal', u'heavy metal', u'neue deutsche h\xe4rte', u'rock', u'deutsch', u'tanz metal', u'rammlied', u'2009', u'epic', u'music for tossing furniture around', u'seen live', u'hard rock', u'germany', u'industrial rock', u'alternative metal', u'christian alexander tietgen', u'Gothic', u'00s', u'anthem', u'european', u'Neue Deutsche Haerte', u'Hammer', u'German metal', u'dance metal', u'Tanzmetal', u'q3', u'liebe ist fur alle da', u'chillout', u'vocal', u'alternative', u'ambient', u'Love', u'Awesome', u'song', u'new', u'12', u'Deutschrock', u'Berlin', u'b-side', u'Europe', u'Nu Metal', u'8 of 10 stars', u'9 of 10 stars', u'best lyrics', u'2000s', u'3 stars']"
117,What A Way To Go - From The HBO Series True Detective / Soundtrack,2470,7099,0,[]
118,Lately - From The HBO Series True Detective,3483,13114,0,[]
119,All The Gold In California - From The HBO Series True Detective,1068,3118,0,[]
120,The Only Thing Worth Fighting For - From The HBO Series True Detective,24392,98012,0,"[u'Soundtrack', u'indie', u'americana', u'Soundtrack Of My Life', u'true detective', u'writhing in emotional pain']"
121,Nevermind,51716,249179,280000,"[u'true detective', u'Soundtrack', u'singer-songwriter', u'new', u'fip', u'leonard cohen', u'radio paradise', u'radioparadise', u'slinky', u'tv music', u'movie song', u'ktcth', u'gr last']"
122,Lately - From The HBO Series True Detective,3483,13114,0,[]
123,My Least Favorite Life - From The HBO Series True Detective,5294,23379,0,[]
124,The Only Thing Worth Fighting For - From The HBO Series True Detective,24392,98012,0,"[u'Soundtrack', u'indie', u'americana', u'Soundtrack Of My Life', u'true detective', u'writhing in emotional pain']"
125,Closer - Unrecalled,9469,16080,0,[u'mixtape kimi']
126,While I'm Still Here - Breyer P-Orridge 'Howler' Remix,12388,28201,0,"[u'alternative rock', u'industrial']"
127,All Time Low - Todd Rundgren Remix,13715,30919,0,"[u'alternative rock', u'industrial', u'alternative', u'experimental', u'nerdcore', u'adam sapphire', u'post-nerdcore', u'Adam Zivojnovich']"
128,Black Noise,57543,258846,88000,"[u'industrial', u'instrumental', u'electronic', u'rock', u'alternative', u'alternative rock', u'10s', u'noise', u'experimental', u'dark', u'industrial rock', u'nine inch nails', u'2013', u'los angeles', u'eletronic', u'colourful song titles', u'Eletronic Rock', u'seen performed live', u'post-nerdcore']"
129,While I'm Still Here,57161,275594,243000,"[u'industrial rock', u'industrial', u'alternative rock', u'rock', u'10s', u'alternative', u'2013', u'eletronic', u'electronic', u'seen live', u'experimental', u'american', u'nine inch nails', u'los angeles', u'Funk Rock', u'eclectonia', u'Eletronic Rock', u'seen performed live', u'fucking bliss', u'surprise sax', u'post-nerdcore', u'it stole my heart']"
130,In Two,59684,288025,332000,"[u'industrial rock', u'industrial', u'alternative rock', u'alternative', u'rock', u'electronic', u'10s', u'american', u'nine inch nails', u'2013', u'los angeles', u'Numerical Titillation', u'eletronic', u'electro-industrial', u'Eletronic Rock', u'post-nerdcore']"
131,I Would for You,62923,324809,273000,"[u'industrial rock', u'industrial', u'rock', u'alternative rock', u'electronic', u'alternative', u'10s', u'experimental', u'Progressive rock', u'dubstep', u'Experimental Rock', u'Awesome', u'american', u'Progressive', u'nine inch nails', u'2013', u'los angeles', u'fav', u'badass', u'eletronic', u'17', u'electronic rock', u'm', u'Eletronic Rock', u'industrial dubstep', u'post-nerdcore']"
132,Running,62827,292499,248000,"[u'industrial', u'industrial rock', u'electronic', u'rock', u'alternative', u'alternative rock', u'2013', u'10s', u'experimental', u'american', u'cool', u'nine inch nails', u'los angeles', u'eletronic', u'electro-industrial', u'Meshuggah', u'Eletronic Rock', u'seen performed live', u'post-nerdcore', u'last fm favorites']"
133,Somewhat Damaged,193730,1230591,271000,"[u'industrial', u'industrial rock', u'angry', u'rock', u'nine inch nails', u'electronic', u'NIN', u'industrial metal', u'trent reznor', u'alternative rock', u'metal', u'alternative', u'favorites', u'90s', u'pissed off', u'intense', u'dark', u'darkwave', u'seen live', u'crazy', u'art rock', u'alternative metal', u'rage', u'the fragile', u'heavy metal', u'electronica', u'hard rock', u'Gothic Rock', u'favorite songs', u'Gothic', u'american', u'winter', u'dark electro', u'aggressive', u'sick', u'essentials', u'6 of 10 stars', u'my music', u'Trent', u'mastertrack', u'Porieux-loved', u'somewhat damaged', u'braindustrial', u'Hip-Hop', u'Grunge', u'Hard', u'goth', u'brutal', u'rap', u'ambient']"
134,Copy of A,114129,741999,323000,"[u'industrial', u'industrial rock', u'electronic', u'synthpop', u'electro-industrial', u'nine inch nails', u'10s', u'seen live', u'rock', u'alternative', u'alternative rock', u'american', u'electronic rock', u'experimental', u'dance', u'techno', u'2013', u'trent reznor', u'somafm', u'Bagel', u'pop', u'goth', u'electro', u'pop rock', u'favorites', u'House', u'ebm', u'Ohio', u'los angeles', u'cold wave', u'8 of 10 stars', u'personal favourites', u'2010s', u'eletronic', u'techno metal', u'good lyrics', u'7 of 10 stars', u'blissful', u'Cleveland', u'industrial pop', u'synth rock', u'best of 2013', u'Good memories', u'metal industrial', u'sonic rock', u'aitch', u'American Industrial', u'Eletronic Rock', u'dorian', u'copy']"
135,Head Like A Hole - Remastered,21738,64350,0,[u'industrial rock']
136,"Dead Souls - From ""The Crow"" Soundtrack",9055,20150,0,[]
137,Discipline,267817,1871531,259000,"[u'industrial', u'industrial rock', u'rock', u'alternative', u'electronic', u'alternative rock', u'nine inch nails', u'NIN', u'00s', u'trent reznor', u'dance', u'2008', u'sexy', u'electronic rock', u'hard rock', u'Awesome', u'american', u'male vocalists', u'trent needs your discipline', u'industrial metal', u'discipline', u'favorites', u'sex', u'lyrics i am repeating in my head', u'seen live', u'Take your shirt off and dance to it', u'pop', u'love at first listen', u'sex music', u'she wants revenge', u'i would like to hear this live', u'angsty disco', u'Disco', u'dark', u'free', u'addictive', u'thank you uncle Reznor', u'I could listen to this all day', u'electropoprock', u'electronica', u'indie', u'catchy', u'party', u'alternative metal', u'FUCKING AWESOME', u'Favourite Songs', u'The Slip', u'dark and sexy', u'take off your shirt and dance', u'setting: driving']"
138,The Hand That Feeds,468435,3650515,212000,"[u'industrial', u'industrial rock', u'rock', u'alternative', u'NIN', u'alternative rock', u'nine inch nails', u'electronic', u'metal', u'favorites', u'00s', u'hard rock', u'rock band', u'industrial metal', u'trent reznor', u'seen live', u'Awesome', u'angry', u'Favourites', u'2005', u'american', u'love at first listen', u'electronica', u'indie', u'sexy', u'Love', u'political', u'goth', u'dark', u'Energetic', u'FUCKING AWESOME', u'Favourite Songs', u'dance', u'Gothic', u'Favorite', u'the hand that feeds', u'classic rock', u'Grunge', u'party', u'sex', u'loved', u'great lyrics', u'electronic rock', u'With Teeth', u'radioultra', u'heavy metal', u'pop', u'punk', u'heavy', u'loud']"
139,13 Ghosts II,101661,504435,219000,"[u'instrumental', u'ambient', u'sleeping trent', u'daydreaming', u'Mellow', u'piano', u'chill', u'experimental', u'electronic', u'alternative', u'industrial', u'trent reznor', u'dark ambient', u'00s', u'never wanna wake up', u'rock', u'alternative rock', u'downtempo', u'beautiful', u'soundscape', u'american', u'soft', u'melancholic', u'throbbing', u'favourite ghosts', u'sexy', u'hard rock', u'slow', u'calm', u'mixtape', u'Awesome', u'melodic', u'Breathing', u'atmospheric', u'drone', u'industrial rock', u'art rock', u'Progressive', u'pretty', u'deep', u'Sleep', u'intense', u'emotional', u'nine inch nails', u'modern classical', u'Ohio', u'relax', u'best of 2008', u'lovely', u'ghosts']"
140,Hurt,511033,3232533,299000,"[u'industrial', u'industrial rock', u'rock', u'alternative', u'NIN', u'sad', u'nine inch nails', u'90s', u'alternative rock', u'electronic', u'beautiful', u'seen live', u'depressing', u'melancholy', u'hurt', u'favorites', u'trent reznor', u'dark', u'industrial metal', u'metal', u'melancholic', u'angry', u'depressive', u'Love', u'american', u'depression', u'cover', u'haunting', u'Favourite Songs', u'1994', u'male vocalists', u'best songs ever', u'hard rock', u'depressed', u'epic', u'Gothic', u'emotional', u'loved', u'electronica', u'goth', u'experimental', u'favorite songs', u'Awesome', u'Mellow', u'live', u'Masterpiece', u'great lyrics', u'drugs', u'makes me cry', u'Johnny Cash']"
141,Closer,660278,4855621,373000,"[u'industrial', u'industrial rock', u'rock', u'alternative', u'sex', u'sexy', u'electronic', u'NIN', u'90s', u'alternative rock', u'nine inch nails', u'industrial metal', u'favorites', u'dark', u'trent reznor', u'closer', u'hard rock', u'metal', u'electronica', u'seen live', u'i want to fuck you like an animal', u'Awesome', u'sex music', u'Favourites', u'Gothic', u'experimental', u'favorite songs', u'angry', u'american', u'pure sex', u'Erotic', u'fuck music', u'dirty', u'Favorite', u'classic', u'BDSM', u'fuck', u'sexual', u'lust', u'Love', u'epic', u'naughty', u'songs about sex', u'intense', u'hot', u'1994', u'music to fuck to', u'NOT INDUSTRIAL', u'Orgasmic', u'alternative metal']"
142,Prelude,203231,1101221,58000,"[u'alternative rock', u'instrumental', u'rock', u'british', u'Prelude', u'listened to this ironically', u'Classical', u'alternative', u'Muse', u'10s', u'seen live', u'hard rock', u'Progressive rock', u'happy', u'Symphonic Rock', u'orchestra', u'contemporary classical', u'male vocalist', u'meditative', u'work', u'7 of 10 stars', u'rocking out', u'opera rock', u'2 stars', u'recos', u'introspectrum', u'The 2nd law', u'artists beginning with m', u'2ndlaw']"
143,Panic Station,302631,2497080,184000,"[u'alternative rock', u'rock', u'funk', u'Funk Rock', u'british', u'alternative', u'Muse', u'10s', u'Progressive rock', u'classic rock', u'love at first listen', u'2010s', u'indie', u'hard rock', u'dance', u'pop rock', u'catchy', u'easy listening', u'funky', u'male vocalist', u'2012', u'7 of 10 stars', u'6 of 10 stars', u'new prog', u'british rock', u'music choice: alternative', u'skoczne', u'best album track', u'The 2nd law', u'Panic Station', u'Disco', u'electronic', u'seen live', u'pop', u'chill', u'revolution', u'experimental', u'happy', u'energy', u'Queen', u'epic', u'britpop', u'bass', u'favourite', u'groovy', u'jazzy', u'male vocalists', u'rock n roll', u'best song ever', u'2013']"
144,Madness,518279,4499682,280000,"[u'rock', u'alternative', u'alternative rock', u'Muse', u'The 2nd law', u'british', u'electronic', u'madness', u'2012', u'pop', u'dubstep', u'male vocalists', u'love at first listen', u'10s', u'sexy', u'Progressive rock', u'electronic rock', u'synthpop', u'magic', u'musestep', u'epic', u'9 of 10 stars', u'2010s', u'Delight', u'glamtastic', u'greatest of the greatest', u'seen live', u'indie', u'soul', u'experimental', u'pop rock', u'Awesome', u'favourite', u'perfect to listen to while leaving the planet', u'want to see live', u'2012 single', u'best of 2012', u'10 of 10 stars', u'new prog', u'british rock', u'i could listen to this forever', u'sonic rock', u'pretty fucking awesome', u'luminous', u'Still Better than radiohead', u'classic rock', u'chillout', u'electropop', u'chill', u'favorite songs']"
145,Delusion Pandemic,16321,75549,262000,"[u'metalcore', u'thrash metal', u'groove metal', u'heavy metal', u'metal', u'grindcore', u'hardcore', u'Progressive metal', u'speed metal', u'groove', u'Progressive', u'thrash', u'death metal', u'deathcore', u'speed', u'2015', u'deathgrind', u'Grind', u'lamb of god', u'progressive thrash metal', u'thrash death metal', u'core', u'Thrash Heavy Metal', u'death thrash metal', u'heavy groove metal', u'progressive groove metal', u'Randy Blythe', u'Heavy Speed Metal', u'groove thrash metal', u'thrash groove metal', u'speed death metal', u'progressive speed metal', u'death speed metal', u'Groove Heavy Metal', u'Speed Groove Metal', u'2015 metal', u'groove speed metal', u'heavy thrash metal speed heavy metal', u'2015 lamb of god', u'2015 groove metal', u'2015 thrash metal', u'2015 speed metal', u'2015 heavy metal']"
146,Engage The Fear Machine,16686,74806,288000,"[u'heavy metal', u'metalcore', u'metal', u'grindcore', u'hardcore', u'Progressive metal', u'speed metal', u'groove', u'thrash metal', u'Progressive', u'thrash', u'death metal', u'6 of 10 stars', u'deathcore', u'speed', u'2015', u'deathgrind', u'groove metal', u'Grind', u'lamb of god', u'progressive thrash metal', u'thrash death metal', u'core', u'Thrash Heavy Metal', u'death thrash metal', u'heavy groove metal', u'progressive groove metal', u'Randy Blythe', u'Heavy Speed Metal', u'groove thrash metal', u'thrash groove metal', u'speed death metal', u'progressive speed metal', u'death speed metal', u'Groove Heavy Metal', u'Speed Groove Metal', u'2015 metal', u'groove speed metal', u'heavy thrash metal speed heavy metal', u'2015 lamb of god', u'2015 groove metal', u'2015 thrash metal', u'2015 speed metal', u'2015 heavy metal']"
147,Footprints,19381,90709,264000,"[u'thrash metal', u'groove metal', u'heavy metal', u'metalcore', u'metal', u'grindcore', u'hardcore', u'Progressive metal', u'speed metal', u'groove', u'Progressive', u'thrash', u'death metal', u'deathcore', u'speed', u'2015', u'deathgrind', u'Grind', u'lamb of god', u'progressive thrash metal', u'thrash death metal', u'core', u'Thrash Heavy Metal', u'death thrash metal', u'heavy groove metal', u'progressive groove metal', u'Randy Blythe', u'Heavy Speed Metal', u'groove thrash metal', u'thrash groove metal', u'speed death metal', u'progressive speed metal', u'death speed metal', u'Groove Heavy Metal', u'Speed Groove Metal', u'2015 metal', u'groove speed metal', u'heavy thrash metal speed heavy metal', u'2015 lamb of god', u'2015 groove metal', u'2015 thrash metal', u'2015 speed metal', u'2015 heavy metal']"
148,Embers,26649,127681,296000,"[u'metalcore', u'metal', u'thrash metal', u'thrash', u'groove metal', u'chino moreno', u'heavy metal', u'grindcore', u'hardcore', u'Progressive metal', u'speed metal', u'groove', u'Progressive', u'death metal', u'Deftones', u'deathcore', u'speed', u'2015', u'deathgrind', u'Grind', u'lamb of god', u'guest vocalist', u'progressive thrash metal', u'thrash death metal', u'core', u'Thrash Heavy Metal', u'death thrash metal', u'heavy groove metal', u'progressive groove metal', u'Randy Blythe', u'Heavy Speed Metal', u'groove thrash metal', u'thrash groove metal', u'speed death metal', u'Uskomaton', u'progressive speed metal', u'death speed metal', u'Groove Heavy Metal', u'Speed Groove Metal', u'2015 metal', u'groove speed metal', u'heavy thrash metal speed heavy metal', u'2015 lamb of god', u'2015 groove metal', u'2015 thrash metal', u'2015 speed metal', u'2015 heavy metal']"
149,512,32071,199236,284000,"[u'metal', u'groove metal', u'heavy metal', u'metalcore', u'rock', u'grindcore', u'hardcore', u'Progressive metal', u'speed metal', u'Melodic Death Metal', u'groove', u'thrash metal', u'Progressive', u'thrash', u'death metal', u'8 of 10 stars', u'deathcore', u'speed', u'2015', u'deathgrind', u'Grind', u'lamb of god', u'progressive thrash metal', u'thrash death metal', u'core', u'Thrash Heavy Metal', u'death thrash metal', u'heavy groove metal', u'progressive groove metal', u'log', u'Randy Blythe', u'Heavy Speed Metal', u'groove thrash metal', u'thrash groove metal', u'speed death metal', u'progressive speed metal', u'death speed metal', u'Groove Heavy Metal', u'Speed Groove Metal', u'2015 metal', u'groove speed metal', u'heavy thrash metal speed heavy metal', u'2015 lamb of god', u'2015 groove metal', u'2015 thrash metal', u'2015 speed metal', u'2015 heavy metal']"
150,Erase This,21766,102903,308000,"[u'metalcore', u'thrash metal', u'groove metal', u'heavy metal', u'metal', u'grindcore', u'hardcore', u'Progressive metal', u'speed metal', u'groove', u'Progressive', u'thrash', u'death metal', u'deathcore', u'speed', u'2015', u'deathgrind', u'Grind', u'lamb of god', u'progressive thrash metal', u'thrash death metal', u'core', u'Thrash Heavy Metal', u'death thrash metal', u'heavy groove metal', u'progressive groove metal', u'Randy Blythe', u'Heavy Speed Metal', u'groove thrash metal', u'thrash groove metal', u'speed death metal', u'progressive speed metal', u'death speed metal', u'Groove Heavy Metal', u'Speed Groove Metal', u'2015 metal', u'groove speed metal', u'heavy thrash metal speed heavy metal', u'2015 lamb of god', u'2015 groove metal', u'2015 thrash metal', u'2015 speed metal', u'2015 heavy metal']"
151,Still Echoes,28257,152326,262000,"[u'metal', u'2015', u'groove metal', u'metalcore', u'thrash metal', u'heavy metal', u'grindcore', u'hardcore', u'Progressive metal', u'speed metal', u'groove', u'Progressive', u'thrash', u'death metal', u'10s', u'6 of 10 stars', u'deathcore', u'speed', u'deathgrind', u'Grind', u'lamb of god', u'progressive thrash metal', u'thrash death metal', u'core', u'Thrash Heavy Metal', u'death thrash metal', u'awesome guitar', u'heavy groove metal', u'progressive groove metal', u'log', u'Randy Blythe', u'Heavy Speed Metal', u'groove thrash metal', u'thrash groove metal', u'speed death metal', u'progressive speed metal', u'death speed metal', u'Groove Heavy Metal', u'Speed Groove Metal', u'best 2015 release', u'Great Drum Mastering', u'Randall Blythe', u'2015 metal', u'groove speed metal', u'heavy thrash metal speed heavy metal', u'2015 lamb of god', u'2015 groove metal', u'2015 thrash metal', u'2015 speed metal', u'2015 heavy metal']"
152,Back For More,53344,405775,204000,"[u'groove metal', u'metal', u'Death Bed Confession', u'heavy metal', u'metalcore', u'hardcore', u'thrash metal', u'alternative metal', u'Favorite', u'Eargasm', u'mainstream rock', u'do or die', u'listen to later', u'los angeles kings', u'ffdp', u'listen to later jennpocalypse']"
153,Generation Dead,49795,355911,223000,"[u'groove metal', u'metalcore', u'metal', u'hardcore', u'thrash metal', u'heavy metal', u'alternative', u'albums I own', u'depressed', u'world', u'amazing', u'hate', u'2011', u'Favorite', u'FUCKING AWESOME', u'Eargasm', u'fuck', u'to check out']"
154,Menace,47867,345845,212000,"[u'groove metal', u'metalcore', u'metal', u'Death Bed Confession', u'hardcore', u'thrash metal']"
155,I See Fire,400875,3762932,298000,"[u'Soundtrack', u'folk', u'Ed Sheeran', u'indie', u'male vocalists', u'beautiful', u'Hobbit', u'the hobbit', u'acoustic', u'pop', u'british', u'singer-songwriter', u'love at first listen', u'chillout', u'calm', u'2013', u'fav', u'I See Fire', u'Love', u'guitar', u'Mellow', u'melancholic', u'indie folk', u'great lyrics', u'I love this song', u'Eargasm', u'2014', u'ed', u'I could listen to this song forever', u'EdSheeran', u'the first song heard by this artist', u'male', u'rock', u'instrumental', u'sad', u'albums I own', u'UK', u'memories', u'happy', u'easy listening', u'soft rock', u'Awesome', u'strings', u'ost', u'contemporary classical', u'smooth', u'soft', u'folk rock', u'quiet', u'male vocalist']"
156,Even My Dad Does Sometimes,95836,486326,229000,"[u'emotion', u'6 of 10 stars', u'drama', u'rock', u'alternative', u'5 Stars', u'3 stars', u'4 of 10 stars', u'you meant 11 of 10 stars']"
157,Shirtsleeves,95020,510434,190000,"[u'pop', u'pop rock', u'favorites', u'7 of 10 stars', u'alternative', u'3 stars', u'4 Stars', u'Boy Thing']"
158,Too Much To Dream,7662,64036,197000,"[u'pop', u'fode viado', u'indie', u'Canadian', u'dream pop', u'synthpop', u'electronic', u'electropop', u'female vocalists', u'2016', u'2016 single', u'collXtion II']"
159,Stay Awake,131303,874545,185000,"[u'indie', u'2010s', u'Sophisti-Pop', u'pop', u'Cocktails at Sunset', u'best of 2013', u'british', u'indie pop', u'female vocalists', u'UK', u'night', u'Gilles Peterson', u'amazing', u'quiet', u'investigate', u'Ballad', u'2013', u'9 of 10 stars', u'Love it', u'<3', u'lush', u'somafm', u'rel-yr:2013', u'rel-mnth:2013:september', u'James Blake', u'london grammar', u'slow alternative rever', u'album of 2013', u'kate upton', u'if you wait', u'camille cerf', u'veronica avluv', u'virginie caprice']"
160,Indestructible,134562,1299476,220000,"[u'swedish', u'electronic', u'pop', u'female vocalists', u'power pop', u'dance', u'electropop', u'beautiful', u'Awesome', u'female vocalist', u'00s', u'2010', u'this song has a great video', u'hardcore', u'electro', u'synthpop', u'best of 2010', u'robyn', u'best songs ever', u'reminds me of you', u'so good', u'songs to get up and dance', u'favorites 2010', u'chillout', u'seen live', u'chill', u'world', u'3', u'World Music', u'Sweden', u'addictive', u'life', u'sunflower', u'Skitz0rz', u'uitluisteren artist', u'Klas Ahlund', u'Punch-Drunk Love', u'holloween skitz0rz', u'Disco', u'Love', u'dance-pop', u'indietronica', u'synth', u'download', u'Electro Pop', u'melancholy', u'Electronic Pop', u'I like', u'sex', u'Favorite']"
161,Suburban War,385662,2898435,285000,"[u'indie rock', u'rock', u'indie', u'alternative rock', u'Canadian', u'alternative', u'Arcade Fire', u'melancholic', u'beautiful', u'art rock', u'love at first listen', u'2010', u'sad', u'epic', u'baroque pop', u'anthem', u'canadiangdchill', u'folk', u'indie pop', u'nostalgic', u'indie folk', u'male vocalists', u'10s', u'haunting', u'Mellow', u'folk rock', u'montreal', u'00s', u'all my old friends they dont know me now', u'chill', u'favorites', u'amazing', u'relaxing', u'male vocalist', u'sweet', u'makes me cry', u'male vocals', u'Masterpiece', u'a masterpiece', u'10 of 10 stars', u'train travel', u'aural orgasms', u'if my soul were composed of musical notes', u'songs that saved my life', u'nice start', u'Consistent Dodo Radio - Flittering', u'seen live', u'pop', u'favorite songs', u'singer-songwriter']"
162,Wonderful Life,298989,3302980,256000,"[u'synthpop', u'electronic', u'british', u'pop', u'hurts', u'new wave', u'2010', u'male vocalists', u'beautiful', u'electropop', u'Awesome', u'indie', u'80s', u'80s not from the 80s', u'Dreamy', u'wow', u'britpop', u'Bittersweet', u'love at first listen', u'lizvelrene2010', u'beautifully depressed', u'wonderful life', u'electronica', u'sexy', u'indie pop', u'synth pop', u'songs that make me think about my friends', u'alternative', u'Retro', u'so fucking true', u'rock', u'dance', u'emotional', u'cool', u'great lyrics', u'wonderful', u'The Vampire Diaries', u'<3', u'electro', u'favorites', u'10s', u'electro-pop', u'Soundtrack Of My Life', u'songs to hear before you die', u'HURTS uk', u'Love', u'catchy', u'great', u'best of 2010', u'fuckin genius']"
163,Waiting Game,211222,1438632,208000,"[u'indie pop', u'indie', u'alternative', u'lush', u'electronic', u'pop', u'female vocalists', u'2013', u'chillout', u'chill', u'world', u'3', u'World Music', u'sunflower', u'best of 2013', u'somafm', u'Skitz0rz', u'uitluisteren artist', u'holloween skitz0rz', u'fav888', u'my dance room', u'electropop', u'downtempo', u'pop rock', u'Love', u'dark', u'acoustic', u'indietronica', u'minimal', u'moody', u'Hope', u'atmospheric', u'r&b', u'melancholy', u'1', u'quiet', u'female vocals', u'Ballad', u'sophisticated', u'cheating', u'fav', u'Guilty Pleasures', u'greys anatomy', u'love at first listen', u'addictive', u'E', u'2010s', u'4 Stars', u'LOVE LOVE LOVE', u'x']"
164,Lust For Life,1433,5892,786000,"[u'electronic', u'trip-hop', u'alternative', u'best of 2017', u'indie', u'trip hop', u'The Weeknd', u'quer lorde']"
165,Half Light I,381103,2582345,254000,"[u'indie rock', u'rock', u'indie', u'alternative rock', u'Canadian', u'alternative', u'chamber pop', u'baroque pop', u'art rock', u'Mellow', u'10s', u'canadiangdchill', u'Arcade Fire', u'indie pop', u'night', u'chilled', u'montreal', u'music for a rainy summer day', u'metal', u'pop', u'favorites', u'christmas', u'britpop', u'beautiful', u'Awesome', u'strings', u'violin', u'Hope', u'pretty', u'Indie-Rock', u'loved', u'duet', u'boys and girls singing together', u'8 of 10 stars', u'2010', u'broken heart', u'male vocals', u'Masterpiece', u'favorite song', u'2010s', u'6 of 10 stars', u'lush', u'little miss sunshine', u'the word light', u'songs of light and dark', u'Merge', u'IIIIIIIIII AMAZING TRACK :D IIIIIIIIII', u'baroque rock', u'Soundtrack Of My Life', u'lacrimaindarkness']"
166,Nevermind,88921,435129,317000,"[u'indie', u'indie pop', u'indie rock', u'10s', u'guitar', u'pop', u'alternative rock', u'beautiful', u'american', u'nostalgic', u'Favorite', u'nostalgia', u'perfect', u'us', u'neo psychedelic', u'midnight music', u'special', u'good vibes', u'foster the people', u'over 5 minutes long', u'beautiful lyrics', u'midnight songs', u'midnight song', u'todamarela']"
167,Of the Night,235546,1747634,213000,"[u'cover', u'pop', u'alternative', u'electronic', u'indie', u'dance', u'british', u'indie pop', u'2013', u'rock', u'mash-up', u'love at first listen', u'10s', u'indie alternative', u'electronica', u'alternative rock', u'indie rock', u'power pop', u'UK', u'Love', u'epic', u'new wave', u'dance-pop', u'House', u'indietronica', u'Awesome', u'night', u'synth', u'upbeat', u'mashup', u'dream pop', u'synthpop', u'amazing', u'male vocalists', u'guilty pleasure', u'alternative pop', u'best song ever', u'Workout', u'alternative dance', u'Music Video', u'mash up', u'crying', u'I love this song', u'Love it', u""I'm in love"", u'Singing', u'cover version', u'sampling', u'<3', u'bastille']"
