,Songs,Listeners,Playcount,Duration,Tags
0,R-Evolve,338960,2314564,239000,"[u'alternative rock', u'rock', u'30 seconds to mars', u'alternative', u'emo', u'Jared Leto', u'indie rock', u'beautiful', u'Progressive rock', u'melancholy', u'modern rock', u'30stm', u'indie', u'sad', u'american', u'deep', u'R-Evolve', u'Love it', u'00s', u'seen live', u'atmospheric', u'emotional', u'hard rock', u'favorites', u'good', u'makes me cry', u'A Beautiful Lie', u'Love', u'Dreamy', u'alternative metal', u'love at first listen', u'Shannon Leto', u'space rock', u'amazing', u'male vocalists', u'FUCKING AWESOME', u'songs to hear before you die', u'echelon', u'chill', u'epic', u'Like', u'intense', u'melancholic', u'Favorite', u'30', u'addicting', u'art-rock', u'feeling', u'wristslitters', u'sonic rock']"
1,The Story,368870,2539975,235000,"[u'alternative rock', u'rock', u'alternative', u'30 seconds to mars', u'emo', u'Progressive rock', u'seen live', u'Jared Leto', u'the story', u'favorites', u'Dreamy', u'melancholic', u'A Beautiful Lie', u'indie', u'30stm', u'Awesome', u'indie rock', u'atmospheric', u'american', u'Favourites', u'sexy voice', u'hot lead singer', u'listened to over and over', u'sad', u'Love', u'my music', u'soundtrack to my life', u'Shannon Leto', u'ambient', u'hard rock', u'calm', u'melancholy', u'00s', u'brilliant', u'30 Second to Mars', u'metal', u'beautiful', u'favourite', u'emotional', u'sex', u'Favorite', u'fav', u'rock ballad', u'life', u'<3', u'beautiful melodies', u'My Favorites', u'dreamer', u'my life in songs', u'Columbine']"
2,From Yesterday,724544,5784678,247000,"[u'alternative rock', u'rock', u'alternative', u'30 seconds to mars', u'emo', u'from yesterday', u'Progressive rock', u'indie', u'Jared Leto', u'30stm', u'hard rock', u'FUCKING AWESOME', u'Awesome', u'modern rock', u'screamo', u'00s', u'favorites', u'Love it', u'metal', u'male vocalists', u'punk rock', u'seen live', u'american', u'punk', u'Favorite', u'pop rock', u'beautiful', u'30 Seconds to Mars - From Yesterday', u'emotional', u'not emo', u'epic', u'space rock', u'love at first listen', u'alternative metal', u'amazing', u'Favourites', u'emocore', u'A Beautiful Lie', u'sexy voice', u'pop', u'favorite songs', u'sexy', u'2007', u'favourite', u'Nu Metal', u'powerful', u'My Favourites', u'Love', u'great song', u'loved']"
3,Savior,348233,2440936,204000,"[u'alternative rock', u'rock', u'30 seconds to mars', u'alternative', u'emo', u'indie', u'Progressive rock', u'savior', u'hard rock', u'Awesome', u'space rock', u'Jared Leto', u'A Beautiful Lie', u'seen live', u'metal', u'industrial', u'30stm', u'indie rock', u'male vocalists', u'favorites', u'Love', u'american', u'00s', u'favorite songs', u'sexy', u'art rock', u'alternative metal', u'deep and meaningful', u'echelon', u'emotional', u'Favorite', u'Love it', u'sexy voice', u'songs that you wanna listen to over and over again', u'loved on first listen', u'30stm is love', u'I love him and his perfect music', u'singer-songwriter', u'drums', u'upbeat', u'Energetic', u'favourite', u'good', u'post-grunge', u'Favourites', u'love at first listen', u'6 of 10 stars', u'Nu-metal', u'sound storm', u'good song']"
4,The Fantasy,416949,3001960,269000,"[u'alternative rock', u'rock', u'30 seconds to mars', u'alternative', u'emo', u'Progressive rock', u'seen live', u'30stm', u'Awesome', u'indie', u'fantasy', u'favorites', u'the fantasy', u'indie rock', u'screamo', u'Jared Leto', u'beautiful', u'american', u'hard rock', u'male vocalist', u'00s', u'Energetic', u'space rock', u'Love', u'alternative metal', u'Masterpiece', u'metal', u'Favorite', u'A Beautiful Lie', u'male vocalists', u'alt rock', u'Shannon Leto', u'favorite songs', u'sexy', u'drums', u'amazing', u'great lyrics', u'FUCKING AWESOME', u'30', u'heard live', u'My Favourites', u'I could listen to this song forever', u'for the fantasy', u'I could sing this song forever', u'30 seconds to mars-the fantasy', u'chill', u'punk rock', u'favourite', u'post-hardcore', u'fav']"
5,Was It a Dream?,411487,3063430,255000,"[u'alternative rock', u'rock', u'30 seconds to mars', u'alternative', u'emo', u'Progressive rock', u'american', u'Jared Leto', u'was it a dream', u'30stm', u'favorites', u'industrial', u'metal', u'indie', u'indie rock', u'screamo', u'seen live', u'beautiful', u'male vocalists', u'Favourites', u'FUCKING AWESOME', u'punk', u'hard rock', u'modern rock', u'00s', u'Dream', u'Favorite Bands', u'Dreamy', u'summer', u'Mellow', u'good', u'Nu Metal', u'Emo rock', u'mood-driven', u'A Beautiful Lie', u'Shannon Leto', u'sexy', u'Love', u'epic', u'Awesome', u'guitar', u'atmospheric', u'amazing', u'loved', u'male vocalist', u'love at first listen', u'i fucking love this song', u'Masterpiece', u'30', u'Favourite Songs']"
6,The Kill (Bury Me),191094,953312,232000,"[u'rock', u'alternative rock', u'alternative', u'30 seconds to mars', u'emo', u'acoustic', u'favorites', u'seen live', u'punk', u'hard rock', u'The Kill', u'Favorite Bands', u'american', u'screamo', u'nostalgic', u'intense', u'Favoritos', u'sachen die ich gerne hoeren mag', u'the kill - 30 seconds to mars', u'love it too much teh kill', u'the best to my heart now', u'Soundtrack', u'indie', u'pop', u'chill', u'Progressive rock', u'USA', u'pop rock', u'Love', u'guitar', u'strings', u'Driving', u'my love', u'alternative metal', u'jazzy', u'modern rock', u'male vocalists', u'live', u'00s', u'ruhig', u'heart', u'9 of 10 stars', u'sugar', u'emocore', u'Bandas que amo', u'Perfection', u'design', u'Yay', u'2', u'30']"
7,A Beautiful Lie,635507,5478005,245000,"[u'alternative rock', u'rock', u'30 seconds to mars', u'alternative', u'emo', u'Progressive rock', u'favorites', u'Jared Leto', u'A Beautiful Lie', u'Awesome', u'30stm', u'beautiful', u'modern rock', u'male vocalists', u'seen live', u'Love', u'Love it', u'30 Seconds to Mars - A Beautiful Lie', u'Beautiful Lie', u'indie', u'hard rock', u'space rock', u'emocore', u'Favourite Songs', u'not emo', u'00s', u'post-hardcore', u'<3', u'metal', u'amazing', u'post-grunge', u'punk', u'power', u'favourite', u'Favourites', u'FUCKING AWESOME', u'All time favourites', u'indie rock', u'catchy', u'epic', u'american', u'punk rock', u'screamo', u'alt rock', u'Nu-metal', u'songs that you wanna listen to over and over again', u'echelon', u'melancholy', u'Favorite', u'songs I absolutely love']"
8,Closer to the Edge,447511,4364800,273000,"[u'alternative rock', u'rock', u'30 seconds to mars', u'alternative', u'00s', u'indie', u'FUCKING AWESOME', u'Makes Me Smile', u'closer to the edge', u'electronic', u'this is war', u'i fucking love this song', u'Awesome', u'Jared Leto', u'songs that you wanna listen to over and over again', u'american', u'love at first listen', u'electronic rock', u'play it loud', u'Its all about the lyrics', u'absolutely wonderful', u'hard rock', u'so fucking amazing', u'Progressive rock', u'epic', u'Energetic', u'makes me move', u'american rock', u'emo', u'great song', u'seen live', u'modern rock', u'post-hardcore', u'synth rock', u'Better Than Sex', u'cimx-fm', u'awesome voice', u'beautiful words', u'Soundtrack For Life', u'more than physical attraction', u'songs that everyone should be listening to', u'great video and song', u'singer-songwriter', u'punk rock', u'space rock', u'amazing', u'loved', u'great lyrics', u'8 of 10 stars', u'Awake']"
9,Kings and Queens,537629,4636075,347000,"[u'alternative rock', u'rock', u'30 seconds to mars', u'alternative', u'songs that you wanna listen to over and over again', u'epic', u'emo', u'indie rock', u'FUCKING AWESOME', u'indie', u'kings and queens', u'american', u'pop', u'00s', u'play it loud', u'male vocalists', u'love at first listen', u'cimx-fm', u'pop rock', u'perfect', u'hard rock', u'this is war', u'songs that make me think about my friends', u'2009', u'Awesome', u'Energetic', u'amazing', u'modern rock', u'post-grunge', u'Kings', u'synthrock', u'Best Band EVER', u'Jared Leto', u'songs that make you want to sing along', u'everyday listening', u'songs that are important to me', u'seen live', u'punk', u'hardcore', u'Progressive rock', u'favorites', u'Post punk', u'great lyrics', u'2010', u'unforgettable', u'epic music', u'if you fall in love with me you should know these songs by heart', u'screaming out', u'songs that cheer me up', u'reasons to breathe']"
10,Lately - From The HBO Series True Detective / Series Finale Version,2099,8075,0,[]
11,Far From Any Road,128609,1074366,168000,"[u'country', u'true detective', u'Alt-country', u'Soundtrack', u'americana', u'folk', u'tv theme', u'true detective ost', u'theme', u'american', u'alt country', u'classic rock', u'rock', u'classic', u'female vocalists', u'singer-songwriter', u'easy listening', u'guitar', u'trumpet', u'haunting', u'ost', u'melancholic', u'fip', u'wishlist', u'male vocalists', u'interesting', u'country rock', u'alternative country', u'duet', u'wow', u'perfect', u'neo folk', u'FUCKING AWESOME', u'2000s', u'radio paradise', u'radioparadise', u""I'm in love"", u'misc', u'love the lyrics', u'2010s', u'chillin', u'Feel Good Music', u'movie', u'earworm', u'old', u'fire', u'cowboys', u'2014', u'too cool for normal tags', u'gothic americana']"
12,Süsswasserfisch,621,2276,200000,[]
13,Verrückt,23725,213318,204000,"[u'industrial metal', u'neue deutsche h\xe4rte', u'rock', u'industrial', u'metal', u'hard rock', u'german', u'Neue Deutsche Haerte', u'female and male vocalists', u'Gothic', u'deutsch', u'industrial rock', u'super', u'male vocalists', u'Gothic Rock', u'2012', u'single', u'10 of 10 stars', u'6 of 10 stars', u'<3', u'Neue Deutsche Harte', u'ohrwurm', u'NDH', u'german industrial', u'fucking brilliant', u'metal industrial', u'schl4nd', u'fuckin good', u'song i have seen live', u'eisbrecher', u'akirahoshi dark', u'akirahoshi unsure', u'Jo Klase ey', u'Besser geht nimmer', u'Ryo-Jas']"
14,Zwischen uns,14866,82449,217000,"[u'industrial metal', u'neue deutsche h\xe4rte', u'german industrial metal']"
15,Silent So Long,2941,10523,317000,"[u'hard rock', u'industrial metal', u'Jonathan Davis', u'industrial', u'Korn', u'Richard Kruspe']"
16,Faust,5645,24182,222000,"[u'hard rock', u'industrial metal']"
17,Happy Times,2723,9971,216000,[u'alternative']
18,Giving Up,5906,26920,238000,"[u'industrial metal', u'hard rock']"
19,Born On My Own,6617,31534,280000,"[u'hard rock', u'industrial metal']"
20,Rainbow,9860,55538,214000,"[u'hard rock', u'industrial metal']"
21,Rock City,7321,22954,208000,[u'4 of 10 stars']
22,Get Down,7651,25681,272000,[u'alternative']
23,Eat You Alive,15989,58166,213000,"[u'metal', u'alternative', u'hard rock', u'industrial', u'industrial metal']"
24,The Light,45652,254230,258000,"[u'metal', u'rock', u'Awesome', u'alternative metal', u'10s', u'heavy metal', u'alternative', u'hard rock', u'beautiful', u'american', u'Nu Metal', u'perfect', u'2010s', u'6 of 10 stars', u'Illinois', u'2015', u'american metal', u'Pop Metal', u'american rock', u'2010s rock', u'2010s Metal', u'illinois rock', u'Illinois Metal']"
25,Open Your Eyes,44263,215032,237000,"[u'metal', u'rock', u'heavy metal', u'alternative metal', u'alternative', u'hard rock', u'Nu Metal', u'10s', u'2010s', u'6 of 10 stars', u'NWOAHM', u'2010s rock', u'2010s Metal']"
26,Hell,89174,602445,255000,"[u'metal', u'Nu Metal', u'hard rock', u'Disturbed', u'heavy metal', u'Nu-metal', u'rock', u'alternative', u'heavy', u'american', u'alternative metal', u'10s', u'hell', u'fight', u'unreleased track', u'alternative rock', u'Progressive metal', u'Awesome', u'male vocalist', u'war', u'2011', u'Favorite', u'FUCKING AWESOME', u'7 of 10 stars', u'Favourite Songs', u'guitar god', u'mainstream rock', u'lacrimaindarkness', u'Adam Title', u'Beloved tracks', u'chicago blackhawks', u'MetallicaSMC', u'david draiman', u'Cool Unreleased Track', u'2010s Metal', u'lts', u'Need For Speed Showdown']"
27,The Eye of the Storm,32871,126008,80000,"[u'metal', u'Nu Metal', u'heavy metal', u'rock', u'instrumental', u'intro', u'alternative metal', u'1 star']"
28,Who,25592,121483,286000,"[u'metal', u'rock', u'alternative metal', u'heavy metal', u'alternative', u'Nu Metal', u'6 of 10 stars']"
29,Legion Of Monsters - Bonus Track,6261,21695,0,[]
30,Immortalized,45596,239506,258000,"[u'metal', u'alternative metal', u'heavy metal', u'rock', u'Nu Metal', u'alternative', u'alternative rock', u'hard rock', u'american', u'love at first listen', u'6 of 10 stars']"
31,Old Friend,31079,155480,215000,"[u'metal', u'alternative metal', u'dexter', u'333', u'heavy metal', u'rock', u'alternative rock', u'Favorite', u'Nu Metal', u'10s', u'bonus track', u'5 of 10 stars', u'hard metal']"
32,Who,25592,121483,286000,"[u'metal', u'rock', u'alternative metal', u'heavy metal', u'alternative', u'Nu Metal', u'6 of 10 stars']"
33,What Are You Waiting For,38071,187105,243000,"[u'metal', u'alternative metal', u'heavy metal', u'Nu Metal', u'rock', u'alternative', u'alternative rock', u'hard rock', u'Favorite', u'Power metal', u'6 of 10 stars']"
34,Legion Of Monsters - Bonus Track,6261,21695,0,[]
35,This Moment,106350,637723,185000,"[u'metal', u'Nu Metal', u'hard rock', u'Soundtrack', u'Disturbed', u'heavy metal', u'rock', u'alternative', u'alternative metal', u'alternative rock', u'Nu-metal', u'transformers', u'american', u'2007', u'FUCKING AWESOME', u'metalcore', u'favorite songs', u'thrash metal', u'rapcore', u'metallica', u'hardrock', u'Fuckin AWESOME', u'2000s rock', u'anarchy punk', u'This Moment', u'ostre granie', u'Favorite Bands', u'Hard', u'hardcore', u'2009', u'Energetic', u'ost', u'cool', u'male vocalist', u'00s', u'chicago', u'best', u'2005', u'8 of 10 stars', u'2000s', u'favorite song', u'Illinois', u'exes', u'Great Music', u'groove metal', u'new metal', u'ott', u'damn', u'awesome lyrics', u'roxor']"
36,Third Reich from the Sun,29986,187388,196000,"[u'industrial', u'industrial metal', u'metal', u'industrial rock', u'german', u'rock', u'electro-industrial', u'american', u'favorite songs', u'heavy', u'catchy', u'angry', u'Rhythmic Noise', u'essentials', u'rage', u'power noise', u'German metal', u'Hanzel und Gretyl', u'robot apocalypse', u'heavy metal', u'electronic', u'USA', u'Awesome', u'guitar', u'nineties', u'Workout', u'4', u'yes', u'Eargasm', u'aggro', u'english lyrics', u'4 of 10 stars', u'feelgood', u'german lyrics', u'fall', u'metropolis', u'United States', u'Neue Deutsche Haerte', u'blingtacular', u'better than radiohead', u'Very Good', u'NDH', u'neue deutsche h\xe4rte', u'metal industrial', u'i will be listening again', u'whee', u'baylok', u'rhythmic industrial', u'womp', u'my favourits']"
37,My World,61792,355701,257000,"[u'industrial metal', u'metal', u'industrial', u'rock', u'industrial rock', u'Soundtrack', u'german', u'Richard Kruspe', u'hard rock', u'alternative rock', u'German metal', u'Resident Evil', u'Neue Deutsche Haerte', u'emigrate', u'heavy metal', u'sexy', u'epic', u'Driving', u'amazing', u'male vocalists', u'programming', u'Rammstein', u'Favourite Songs', u'european', u'Dancing in my underwear', u'Heavy Duty Fast Metal', u'test', u'electric guitar', u'Radio', u'alternative metal', u'interesting', u'guitars', u'evil', u'movie soundtrack', u'Industrial Techno', u'neue deutsche h\xe4rte', u'current obsessions', u'genial', u'jones', u'englisch', u'my world', u'false lyrics', u'My own classics', u'resident Evil extinction', u'soulshot', u'my own sticks and stones', u'micks music', u'Rammstein dude']"
38,Wake Up,43522,247948,211000,"[u'industrial metal', u'industrial', u'german', u'metal', u'rock', u'industrial rock', u'Richard Kruspe', u'Rammstein', u'Neue Deutsche Haerte', u'emigrate', u'test', u'hardcore', u'sexy', u'Gothic', u'Awesome', u'Driving', u'deutsch', u'amazing', u'darkwave', u'not bad', u'Gothic Rock', u'3 stars', u'6 of 10 stars', u'neue deutsche h\xe4rte', u'rammstein rock', u'tanz-metal', u'stx', u'GER', u'9th evolution', u'godnota', u'9e', u'under 87665009756551896889899987854287765479831234470946568933668823144561 listeners']"
39,In My Tears,32043,175013,274000,"[u'industrial metal', u'industrial', u'rock', u'metal', u'alternative metal', u'german', u'industrial rock', u'basketball', u'motorcycle', u'Richard Kruspe', u'megalol', u'emigrate', u'alternative rock', u'heavy', u'dark', u'synth', u'deutsch', u'melancholy', u'melancholic', u'male vocalists', u'lol', u'4 Stars', u'Low', u'real', u'depressive', u'German metal', u'neue deutsche h\xe4rte', u'Ja', u'UFC', u'lucipro', u'noctemphilia', u'ski', u'makes my flesh creep', u'depression and suicide life', u'stein um stein', u'2-5 Stars', u'for fucking', u'vg duel', u'INCITY']"
40,Let Me Break,33007,166850,215000,"[u'industrial metal', u'industrial', u'industrial rock', u'rock', u'german', u'metal', u'alternative', u'hard rock', u'good shit', u'Rammstein', u'Hairgel', u'I would love to see this artist or band live one day', u'heavy metal', u'alternative rock', u'00s', u'neue deutsche h\xe4rte', u'Richard Kruspe', u'emigrate', u'love-lyrics', u'Inquisite']"
41,My World,61792,355701,257000,"[u'industrial metal', u'metal', u'industrial', u'rock', u'industrial rock', u'Soundtrack', u'german', u'Richard Kruspe', u'hard rock', u'alternative rock', u'German metal', u'Resident Evil', u'Neue Deutsche Haerte', u'emigrate', u'heavy metal', u'sexy', u'epic', u'Driving', u'amazing', u'male vocalists', u'programming', u'Rammstein', u'Favourite Songs', u'european', u'Dancing in my underwear', u'Heavy Duty Fast Metal', u'test', u'electric guitar', u'Radio', u'alternative metal', u'interesting', u'guitars', u'evil', u'movie soundtrack', u'Industrial Techno', u'neue deutsche h\xe4rte', u'current obsessions', u'genial', u'jones', u'englisch', u'my world', u'false lyrics', u'My own classics', u'resident Evil extinction', u'soulshot', u'my own sticks and stones', u'micks music', u'Rammstein dude']"
42,Emigrate,40623,215913,247000,"[u'industrial metal', u'industrial', u'industrial rock', u'rock', u'german', u'metal', u'Rammstein', u'deutsch', u'alternative metal', u'Good Metal', u'richard cruspe', u'hard rock', u'emigrate', u'indie rock', u'00s', u'Nu Metal', u'blingtacular', u'Solo Project', u'oddlyinteresting', u'GER', u'gerineng', u'rammstein guitarist', u'test', u'good', u'3 stars', u'better than radiohead', u'neue deutsche h\xe4rte', u'h', u'Richard Kruspe', u'under 87665009756551896889899987854287765479831234470946568933668823144561 listeners']"
43,Hypothetical,5837,22958,230000,"[u'marilyn manson', u'industrial metal', u'Rammstein']"
44,Get Down,7651,25681,272000,[u'alternative']
45,Eat You Alive,15989,58166,213000,"[u'metal', u'alternative', u'hard rock', u'industrial', u'industrial metal']"
46,Silent So Long,2941,10523,317000,"[u'hard rock', u'industrial metal', u'Jonathan Davis', u'industrial', u'Korn', u'Richard Kruspe']"
47,Happy Times,2723,9971,216000,[u'alternative']
48,My Pleasure,5858,23743,216000,"[u'industrial metal', u'metal', u'hard rock', u'german industrial', u'emigrate']"
49,Faust,5645,24182,222000,"[u'hard rock', u'industrial metal']"
50,Eat You Alive,15989,58166,213000,"[u'metal', u'alternative', u'hard rock', u'industrial', u'industrial metal']"
51,Kopf oder Zahl,3725,16519,248000,"[u'metal', u'Gothic', u'Gothic Rock', u'neue deutsche h\xe4rte', u'metal industrial', u'deutsch hart geil']"
52,Mann im Mond,4333,19604,316000,"[u'metal', u'Gothic', u'industrial metal', u'Gothic Rock', u'6 of 10 stars', u'neue deutsche h\xe4rte', u'metal industrial', u'deutsch hart geil']"
53,Feindbild,3938,17008,284000,"[u'metal', u'industrial', u'metal industrial', u'deutsch hart geil', u'christian alexander tietgen']"
54,Heute Nacht,6445,30001,343000,"[u'industrial metal', u'neue deutsche h\xe4rte', u'metal', u'Gothic', u'Gothic Metal', u'Gothic Rock', u'2012', u'metal industrial', u'deutsch hart geil']"
55,Ja genau,16047,104857,281000,"[u'industrial', u'german', u'metal', u'deutsch', u'rock', u'industrial metal', u'hard rock', u'neue deutsche h\xe4rte', u'megaherz', u'heavy metal', u'Gothic', u'industrial rock', u'amazing', u'Gothic Rock', u'german lyrics', u'Neue Deutsche Haerte', u'NDH', u'great title', u'deutsch hart geil']"
56,Miststück,15757,112784,210000,"[u'industrial', u'rock', u'Neue Deutsche Haerte', u'deutsch', u'german', u'industrial metal', u'ohrwurm', u'neue deutsche h\xe4rte', u'megaherz', u'hard rock', u'Gothic', u'industrial rock', u'Deutschrock', u'aggressive', u'darkwave', u'Gothic Rock', u'3 stars', u'7 of 10 stars', u'german lyrics', u'headbanging', u'NDH', u'All time favourites', u'deutsch hart geil', u'Deutscher Metal', u'Neue Deutsch Haerte', u'bwaaaahahahaha-Lied', u'christian alexander tietgen', u'Rabenschwarze']"
57,Rock Me Amadeus,16442,98485,206000,"[u'industrial', u'cover', u'german', u'metal', u'unusual covers', u'rock', u'Gothic', u'industrial metal', u'neue deutsche h\xe4rte', u'Metal cover of pop song', u'alternative', u'hard rock', u'industrial rock', u'covers', u'Gothic Metal', u'Gothic Rock', u'9 of 10 stars', u'7 of 10 stars', u'10 of 10 stars', u'german lyrics', u'NDH', u'catchy as hell', u'industrial covers', u'megaherz', u'sing in the kitchen', u'song with great changing rhythm if you turn this song on to a zebra called jindrich z podebrad it would change him his stripes for green and yellow colour and it is  scientifically proved really xd', u'Neune Deutsche Haerte']"
58,5. März,75152,386573,258000,"[u'industrial metal', u'megaherz', u'german', u'neue deutsche h\xe4rte', u'industrial', u'metal', u'deutsch', u'Gothic', u'rock', u'Neue Deutsche Haerte', u'5 Marz', u'Deutschrock', u'favorite songs', u'hard rock', u'Nu Metal', u'NDH', u'german rock', u'oomph', u'seen live', u'goth', u'Awesome', u'industrial rock', u'darkwave', u'cool', u'Gothic Rock', u'Favourites', u'5 Stars', u'pain', u'male vocals', u'Love it', u'10 of 10 stars', u'german lyrics', u'static-x', u'sad lovesongs', u'owns my soul', u'germany industrial metal', u'german metal band', u'heavy metal', u'80s', u'alternative', u'alternative rock', u'Hard', u'heavy', u'sad', u'favorites', u'Love', u'beautiful', u'90s', u'germany', u'angry']"
59,Jagdzeit,13902,68410,258000,"[u'industrial', u'metal', u'industrial metal', u'neue deutsche h\xe4rte', u'rock', u'hard rock', u'Gothic', u'industrial rock', u'german', u'Gothic Rock', u'8 of 10 stars', u'Neue Deutsche Haerte', u'german industrial', u'metal industrial', u'deutsch hart geil', u'deutsche metal']"
60,Eat You Alive,15989,58166,213000,"[u'metal', u'alternative', u'hard rock', u'industrial', u'industrial metal']"
61,Skills in Pills,25620,162648,253000,"[u'metal', u'industrial metal', u'industrial', u'symphonic metal', u'english', u'6 of 10 stars', u'lindemann']"
62,Praise Abort,28337,214022,284000,"[u'german', u'industrial metal', u'metal', u'industrial', u'deutsch', u'2015 single', u'epic', u'new', u'feminist', u'wtf', u'Rammstein', u'irony', u'shock', u'Till Lindemann', u'lindemann', u'Skills in Pills']"
63,Wildfire,137144,763136,255000,"[u'american', u'folk rock', u'country blues', u'country', u'blues', u'guitar', u'2010s', u'clapping', u'john mayer', u'pop', u'chill', u'folk', u'singer-songwriter', u'pop rock', u'upbeat', u'summer', u'blues rock', u'male vocalist', u'country pop', u'2013', u'road trip', u'letterman', u'10s', u'best of 2013', u'OneRepublic', u'palmas', u'middle', u'johnmayer', u'2013 single', u'acourstic', u'bluesfest 2014', u'justwannalisten']"
64,Until the World Goes Cold,37011,194191,321000,"[u'heavy metal', u'metalcore', u'metal', u'rock', u'Awesome', u'thrash metal', u'2015']"
65,RU486,39237,251086,262000,"[u'alternative metal', u'hard rock', u'heard live', u'Nu-metal', u'Stone Sour', u'heavy metal', u'thrash metal', u'Nu Metal', u'2010s', u'great intros', u'Awesome Drums', u'music choice: metal']"
66,Absolute Zero,97711,688106,229000,"[u'alternative metal', u'hard rock', u'rock', u'Nu-metal', u'Stone Sour', u'Nu Metal', u'wrif-fm', u'music choice: metal', u'metal', u'great lyrics', u'stoner metal', u'iowa', u'5 Stars', u'2012', u'10s', u'2010s', u'heard live', u'Metall', u'corey taylor', u'Music Choice: Rock', u'rock bryan mute song', u'favourite of 2012', u'9207', u'UltraNew']"
67,Don't Trip,3132,10288,178000,[]
68,I Want U,26713,133991,205000,"[u'trap', u'dance', u'Dreamy', u'sick', u'vocal trap', u'traplife']"
69,Surface,29577,199328,254000,"[u'trap', u'monstercat', u'chillout', u'lovedbyme', u'cocaine in the bed', u'weed in the bed', u'weed in the shower', u'lovedbyme1', u'Aero Chord']"
70,Warrior of The Night - Original Mix,2738,8921,253000,"[u'trap', u'cocaine in the bed']"
71,Mosh Pit,12460,39381,198000,"[u'electronic', u'hip hop', u'alternative', u'rap', u'electro house', u'trap']"
72,Soundclash,14812,50880,201000,[]
73,Day Ones,6896,24918,171000,"[u'colbert', u'novelist']"
74,Badman,4064,15947,159000,[]
75,Speak for Me,83845,418062,225000,"[u'acoustic', u'pop rock', u'john mayer', u'rock', u'alternative', u'folk', u'blues', u'beautiful', u'american', u'folk rock', u'8 of 10 stars', u'10s', u'born and raised', u'speak for me', u'country - indie']"
76,Shadow Days,143589,795569,235000,"[u'pop', u'rock', u'american', u'john mayer', u'alternative', u'country', u'folk', u'acoustic', u'10s', u'singer-songwriter', u'pop rock', u'calm', u'blues', u'Radio', u'Alt-country', u'male vocalists', u'Southern Rock', u'love at first listen', u'2012 single', u'2010s', u'wise', u'best of 2012', u'7 of 10 stars', u'Faves', u'chillax', u'good tunes', u'johnmayer', u'paula', u'Channel X', u'Vida', u'country music television', u'rock :-0', u'music choice: adult alternative', u'Elton Lima', u'Elton Limma', u'beanoboo', u'shadow days', u'gimme sum acoustic heart', u'johnmayer pop brazil sp shadowdays']"
